{
  "elements": [
    {
      "id": "e-slab-01",
      "ifcClass": "IfcSlab",
      "ifcGuid": "14t7YOs$QNL7Hfom5OO5uF",
      "name": "Decke über EG",
      "paperBBox": [
        62.5,
        232.5,
        588.5,
        528.5
      ],
      "predefinedType": "FLOOR",
      "provenance": "authored",
      "representation": "projection",
      "tag": "Pos. 1",
      "viewport": "vp-plan"
    },
    {
      "id": "e-col-03",
      "ifcClass": "IfcColumn",
      "ifcGuid": "35yaOqH4Nem10GwTKnHNFi",
      "name": "Stütze St-03",
      "paperBBox": [
        188.5,
        320.5,
        196.5,
        328.5
      ],
      "predefinedType": "COLUMN",
      "provenance": "authored",
      "representation": "cut",
      "tag": "Pos. 12",
      "viewport": "vp-plan"
    },
    {
      "id": "e-col-04",
      "ifcClass": "IfcColumn",
      "ifcGuid": "1nXnYJ2NS1JiEfZwyX9QDv",
      "name": "Stütze St-04",
      "paperBBox": [
        318.5,
        320.5,
        326.5,
        328.5
      ],
      "predefinedType": "COLUMN",
      "provenance": "authored",
      "representation": "cut",
      "tag": "Pos. 13",
      "viewport": "vp-plan"
    },
    {
      "id": "e-beam-21",
      "ifcClass": "IfcBeam",
      "ifcGuid": "3_GaaO8X6uLazfD6E6HURY",
      "name": "Unterzug UZ-01",
      "paperBBox": [
        188.5,
        318.5,
        326.5,
        330.5
      ],
      "predefinedType": "BEAM",
      "provenance": "authored",
      "representation": "projection",
      "tag": "Pos. 21",
      "viewport": "vp-plan"
    },
    {
      "id": "e-wall-02",
      "ifcClass": "IfcWall",
      "ifcGuid": "36mbdvH0V3m78vPYudnN$o",
      "name": "Außenwand WA-02",
      "paperBBox": [
        62.5,
        232.5,
        588.5,
        238.5
      ],
      "predefinedType": "SOLIDWALL",
      "provenance": "authored",
      "representation": "cut",
      "tag": "Pos. 31",
      "viewport": "vp-plan"
    }
  ],
  "generator": {
    "created": "2026-03-04T09:12:00Z",
    "name": "planlabel",
    "version": "0.1.0"
  },
  "model": {
    "file": "lindenhof-tragwerk.ifc",
    "lengthUnit": "m",
    "schema": "IFC4",
    "sha256": "fa8d382f78065e81fce348247f7a98eff9b0faa0aa8bff92aeeae4ba5a568d69"
  },
  "page": {
    "heightMm": 594,
    "index": 3,
    "rotation": 0,
    "widthMm": 841
  },
  "planlabel": "0.1",
  "provenance": "authored",
  "sheet": {
    "author": "K. Brandt",
    "checker": "M. Hoffmann",
    "date": "2026-03-04",
    "discipline": "structure",
    "documentId": "LIN-ZZ-01-DR-S-0201",
    "drawingType": "positionsplan",
    "id": "TWP-201",
    "project": {
      "name": "Wohnanlage Lindenhof",
      "number": "2024-118"
    },
    "revision": "C",
    "scale": 50,
    "status": "Ausführungsplanung",
    "title": "Positionsplan Decke über EG",
    "titleBlockBBox": [
      651,
      10,
      831,
      180
    ]
  },
  "viewports": [
    {
      "cutHeight": 1.2,
      "id": "vp-plan",
      "kind": "plan",
      "name": "Decke über EG",
      "paperBBox": [
        30,
        200,
        620,
        560
      ],
      "paperToPlane": [
        0.05,
        0,
        0,
        0.05,
        -2.5,
        -11.2
      ],
      "plane": {
        "origin": [
          0,
          0,
          1.2
        ],
        "xAxis": [
          1,
          0,
          0
        ],
        "yAxis": [
          0,
          1,
          0
        ]
      },
      "scale": 50,
      "storey": {
        "elevation": 0,
        "ifcGuid": "14O95KmiOgf9ja8pP3Psax",
        "name": "EG"
      }
    }
  ]
}
